[
  {
    "id": "drone-nep-dji-mini4pro-001",
    "manufacturer": "DJI",
    "model": "Mini 4 Pro",
    "weightGrams": 249,
    "maxAltitudeMeters": 4000,
    "hasCamera": true,
    "takeoffWeightGrams": 249,
    "category": "A",
    "registrationRequired": true,
    "insuranceRequired": false,
    "licenseRequired": false,
    "commercialAllowed": true,
    "remoteIdSupport": true,
    "batteryType": "LiPo 2S",
    "firmwareVersion": "v01.00.0300"
  },
  {
    "id": "drone-nep-dji-mini3-001",
    "manufacturer": "DJI",
    "model": "Mini 3",
    "weightGrams": 248,
    "maxAltitudeMeters": 4000,
    "hasCamera": true,
    "takeoffWeightGrams": 248,
    "category": "A",
    "registrationRequired": true,
    "insuranceRequired": false,
    "licenseRequired": false,
    "commercialAllowed": true,
    "remoteIdSupport": true,
    "batteryType": "LiPo 2S",
    "firmwareVersion": "v01.00.0100"
  },
  {
    "id": "drone-nep-dji-air3-001",
    "manufacturer": "DJI",
    "model": "Air 3",
    "weightGrams": 720,
    "maxAltitudeMeters": 6000,
    "hasCamera": true,
    "takeoffWeightGrams": 720,
    "category": "B",
    "registrationRequired": true,
    "insuranceRequired": false,
    "licenseRequired": false,
    "commercialAllowed": true,
    "remoteIdSupport": true,
    "batteryType": "LiIon 4S",
    "firmwareVersion": "v01.00.0600"
  },
  {
    "id": "drone-nep-dji-mavic3-001",
    "manufacturer": "DJI",
    "model": "Mavic 3",
    "weightGrams": 895,
    "maxAltitudeMeters": 6000,
    "hasCamera": true,
    "takeoffWeightGrams": 895,
    "category": "B",
    "registrationRequired": true,
    "insuranceRequired": false,
    "licenseRequired": false,
    "commercialAllowed": true,
    "remoteIdSupport": true,
    "batteryType": "LiPo 4S",
    "firmwareVersion": "v01.00.1200"
  },
  {
    "id": "drone-nep-dji-inspire3-001",
    "manufacturer": "DJI",
    "model": "Inspire 3",
    "weightGrams": 3995,
    "maxAltitudeMeters": 7000,
    "hasCamera": true,
    "takeoffWeightGrams": 4310,
    "category": "C",
    "registrationRequired": true,
    "insuranceRequired": true,
    "licenseRequired": true,
    "commercialAllowed": true,
    "remoteIdSupport": true,
    "batteryType": "LiPo 6S",
    "firmwareVersion": "v01.00.0200"
  },
  {
    "id": "drone-nep-autel-evo-lite-001",
    "manufacturer": "Autel",
    "model": "EVO Lite",
    "weightGrams": 835,
    "maxAltitudeMeters": 5000,
    "hasCamera": true,
    "takeoffWeightGrams": 835,
    "category": "B",
    "registrationRequired": true,
    "insuranceRequired": false,
    "licenseRequired": false,
    "commercialAllowed": true,
    "remoteIdSupport": true,
    "batteryType": "LiPo 3S",
    "firmwareVersion": "v1.3.10"
  },
  {
    "id": "drone-nep-skydio-2plus-001",
    "manufacturer": "Skydio",
    "model": "2+",
    "weightGrams": 800,
    "maxAltitudeMeters": 4500,
    "hasCamera": true,
    "takeoffWeightGrams": 800,
    "category": "B",
    "registrationRequired": true,
    "insuranceRequired": false,
    "licenseRequired": false,
    "commercialAllowed": true,
    "remoteIdSupport": false,
    "batteryType": "LiPo 3S",
    "firmwareVersion": "v21.1.20"
  }
]
